year,date_text,title,url,codes,kind
2018,12 Dec 2018,"The Listing Committee criticises Chen Xing Development Holdings Limited (Stock Code: 2286) for breaching the Listing Rules, and censures a number of its current directors for breaching the Director’s Undertaking",https://www.hkex.com.hk/News/Regulatory-Announcements/2018/181212news?sc_lang=en,02286,other
2018,27 Jul 2018,Exchange Publishes CG Code Consultation Conclusions and Guidance for Boards and Directors,https://www.hkex.com.hk/News/Regulatory-Announcements/2018/180727news?sc_lang=en,,other
2018,16 May 2018,The Listing Committee censures Boer Power Holdings Limited (Stock Code: 1685) and a number of its current and former directors for breaching the Exchange Listing Rules and/or the Director’s Undertaking,https://www.hkex.com.hk/News/Regulatory-Announcements/2018/180516news?sc_lang=en,01685,other
2018,04 May 2018,Exchange Announces Formation of Biotech Advisory Panel,https://www.hkex.com.hk/News/Regulatory-Announcements/2018/1805042news?sc_lang=en,,other
2018,02 Feb 2018,Listing Nominating Committee Seeks Listing Committee Candidates,https://www.hkex.com.hk/News/Regulatory-Announcements/2018/180202news?sc_lang=en,,other
2019,30 Dec 2019,"The Listing Committee censures Mr Hu Guo An, former executive director of Future Bright Mining Holdings Limited (Stock Code: 2212), for breaching the Listing Rules and the Director’s Undertaking",https://www.hkex.com.hk/News/Regulatory-Announcements/2019/191230news?sc_lang=en,02212,other
2019,27 Dec 2019,Announcement – In relation to the matter of China Candy Holdings Limited (Incorporated in Cayman Islands with limited liability) (Stock Code: 8182) Cancellation of listing,https://www.hkex.com.hk/News/Regulatory-Announcements/2019/1912272news?sc_lang=en,08182,cancellation
2019,27 Dec 2019,Announcement – In relation to the matter of Hsin Chong Group Holdings Limited (Incorporated in Bermuda with limited liability) (Stock Code: 404) Cancellation of listing,https://www.hkex.com.hk/News/Regulatory-Announcements/2019/191227news?sc_lang=en,00404,cancellation
2019,23 Dec 2019,Announcement – In relation to the matter of Yorkshine Holdings limited (Incorporated in Singapore with limited liability) (Stock Code: 1048) Cancellation of listing,https://www.hkex.com.hk/News/Regulatory-Announcements/2019/191223news?sc_lang=en,01048,cancellation
2019,20 Dec 2019,The Listing Committee censures Ding He Mining Holdings Limited (Stock Code: 705) and a number of its current directors for breaching the Listing Rules and/or the Director’s Undertaking,https://www.hkex.com.hk/News/Regulatory-Announcements/2019/191220news?sc_lang=en,00705,other
2019,18 Dec 2019,Exchange Publishes ESG Guide Consultation Conclusions and its ESG Disclosure Review Findings,https://www.hkex.com.hk/News/Regulatory-Announcements/2019/191218news?sc_lang=en,,other
2019,18 Dec 2019,"Announcement – In relation to the matter of China Huishan Dairy Holdings Company Limited (the “Company”) (the “Company” and, together with its subsidiaries, the “Group”) (Stock code: 6863) Cancellation of listing",https://www.hkex.com.hk/News/Regulatory-Announcements/2019/1912182news?sc_lang=en,06863,cancellation
2019,11 Dec 2019,The Listing Committee censures Artini Holdings Limited (Stock Code: 789) for breaching the Listing Rules,https://www.hkex.com.hk/News/Regulatory-Announcements/2019/191211news?sc_lang=en,00789,other
2019,06 Dec 2019,Exchange Seeks Views on Review of Listing Regime for Debt Issues to Professional Investors Only,https://www.hkex.com.hk/News/Regulatory-Announcements/2019/191206news?sc_lang=en,,other
2019,06 Dec 2019,Announcement – In relation to the matter of Shenzhou Space Park Group Limited (Incorporated in Bermuda with limited liability) (Stock Code: 692) Cancellation of listing,https://www.hkex.com.hk/News/Regulatory-Announcements/2019/1912062news?sc_lang=en,00692,cancellation
2019,02 Dec 2019,"The GEM Listing Committee criticises Mr. Guo Xia William, executive director and Chairman of China Health Group Inc. (Stock Code: 8225), for breaching the GEM Listing Rules and the Director’s Undertaking",https://www.hkex.com.hk/News/Regulatory-Announcements/2019/191202news?sc_lang=en,08225,other
2019,21 Nov 2019,"Announcement – In relation to the matter of Fuguiniao Co., Ltd. (A joint stock company established in the People’s Republic of China with limited liability) (Stock Code: 1819) Cancellation of listing",https://www.hkex.com.hk/News/Regulatory-Announcements/2019/191121news?sc_lang=en,01819,cancellation
2019,20 Nov 2019,Announcement – In relation to the matter of National Agricultural Holdings Limited (Incorporated in the Cayman Islands with limited liability) (Stock Code: 1236) Cancellation of listing,https://www.hkex.com.hk/News/Regulatory-Announcements/2019/1911202news?sc_lang=en,01236,cancellation
2019,29 Oct 2019,HKEX Enhances Guidance for Overseas Companies Seeking to List in Hong Kong,https://www.hkex.com.hk/News/Regulatory-Announcements/2019/191029news?sc_lang=en,,other
2019,18 Oct 2019,Exchange Announces the Effective Date of Unwinding the Delegated Authority to Approve GEM Listing Applications and Publishes Related Changes to GEM Listing Rules,https://www.hkex.com.hk/News/Regulatory-Announcements/2019/191018news?sc_lang=en,,other
2019,11 Oct 2019,Announcement – In relation to the matter of Changgang Dunxin Enterprise Company Limited (in Provisional Liquidation) (Stock Code: 2229) Cancellation of listing,https://www.hkex.com.hk/News/Regulatory-Announcements/2019/191011news?sc_lang=en,02229,cancellation
2019,27 Sep 2019,The Listing Committee criticises Yashili International Holdings Limited (Stock Code: 1230) for breaching the Listing Rules,https://www.hkex.com.hk/News/Regulatory-Announcements/2019/190927news?sc_lang=en,01230,other
2019,23 Sep 2019,Announcement – In relation to the matter of Pacific Andes International Holdings Limited (Incorporated in Bermuda with limited liability) (Stock Code: 1174) Cancellation of listing,https://www.hkex.com.hk/News/Regulatory-Announcements/2019/190923news?sc_lang=en,01174,cancellation
2019,20 Sep 2019,"The Listing Committee censures Mr Xiang Liang, former executive director of China Environmental Energy Investment Limited (Stock Code: 986), for breaching the Settlement Agreement and the Committee’s Direction",https://www.hkex.com.hk/News/Regulatory-Announcements/2019/190920news?sc_lang=en,00986,other
2019,06 Sep 2019,"The Listing Committee censures Shandong Molong Petroleum Machinery Company Limited (Stock Code: 568), and censures or criticises a number of its former directors for breaching the Exchange Listing Rules and/or the Director’s Undertaking; and censures a number of its former supervisors for breaching the Supervisor’s Undertaking",https://www.hkex.com.hk/News/Regulatory-Announcements/2019/1909062news?sc_lang=en,00568,other
2019,28 Aug 2019,Announcement – In relation to the matter of Zhejiang Prospect Company Limited (Stock Code: 8273) Cancellation of listing,https://www.hkex.com.hk/News/Regulatory-Announcements/2019/1908282news?sc_lang=en,08273,cancellation
2019,21 Aug 2019,Announcement – In relation to the matter of Shenji Group Kunming Machine Tool Company Limited (A joint stock limited company incorporated in the People’s Republic of China with limited liability) (Stock Code: 300) Cancellation of listing,https://www.hkex.com.hk/News/Regulatory-Announcements/2019/190821news?sc_lang=en,00300,cancellation
2019,14 Aug 2019,Announcement – In relation to the matter of China Nonferrous Metals Company Limited (Incorporated in Bermuda with limited liability) (Stock Code: 8306) Cancellation of listing,https://www.hkex.com.hk/News/Regulatory-Announcements/2019/1908144news?sc_lang=en,08306,cancellation
2019,02 Aug 2019,Exchange Publishes Consultation Paper on Codification of General Waivers and Principles relating to IPOs and Listed Issuers and Minor Rule Amendments,https://www.hkex.com.hk/News/Regulatory-Announcements/2019/190802news?sc_lang=en,,other
2019,29 Jul 2019,The Listing Committee censures a number of the current directors of Amax International Holdings Limited (Stock Code: 959) for breaching the Listing Rules and the Director’s Undertaking,https://www.hkex.com.hk/News/Regulatory-Announcements/2019/190729news?sc_lang=en,00959,other
2019,29 Jul 2019,"The GEM Listing Committee censures Mr Liang Jian Heng, a former controlling shareholder of Wan Cheng Metal Packaging Company Limited (Stock Code: 8291), for breaching the GEM Listing Rules and the Director’s Undertaking.",https://www.hkex.com.hk/News/Regulatory-Announcements/2019/1907292news?sc_lang=en,08291,other
2019,26 Jul 2019,"Exchange Publishes Conclusions on Proposed Rule Changes Associated with Backdoor Listing and Shell Activities to Strengthen Long-term Health, Quality and Sustainability of the Market",https://www.hkex.com.hk/News/Regulatory-Announcements/2019/190726news?sc_lang=en,,other
2019,15 Jul 2019,China Regenerative Medicine International Limited (Stock Code: 8158) and twelve of its current and former directors censured or criticised for breaching the GEM Listing Rules and the Director’s Undertaking,https://www.hkex.com.hk/News/Regulatory-Announcements/2019/190715news?sc_lang=en,08158,other
2019,05 Jul 2019,New Review Structure for Listing Committee Decisions and Appointment of Inaugural Listing Review Committee,https://www.hkex.com.hk/News/Regulatory-Announcements/2019/1907052news?sc_lang=en,,listing_review
2019,05 Jul 2019,Appointment of Listing Committee Members,https://www.hkex.com.hk/News/Regulatory-Announcements/2019/190705news?sc_lang=en,,other
2019,04 Jul 2019,Announcement - In relation to the matter of Rui Feng Group Holdings Company Limited (Incorporated in Cayman Islands with limited liability) (Stock code: 8312) Cancellation of listing,https://www.hkex.com.hk/News/Regulatory-Announcements/2019/1907042news?sc_lang=en,08312,cancellation
2019,04 Jul 2019,"Announcement - In relation to the matter of Flyke International Holdings Limited (the “Company”) (the “Company” and, together with its subsidiaries, the “Group”) (Stock code: 1998) Proceeding to third stage of delisting procedures",https://www.hkex.com.hk/News/Regulatory-Announcements/2019/190704news?sc_lang=en,01998,other
2019,26 Jun 2019,"Announcement - In relation to the matter of Centron Telecom International Holding Limited (the “Company”) (the “Company” and, together with its subsidiaries, the “Group”) (Stock code: 1155) Proceeding to third stage of delisting procedures",https://www.hkex.com.hk/News/Regulatory-Announcements/2019/1906262news?sc_lang=en,01155,other
2019,26 Jun 2019,Announcement - In relation to the matter of Heng Xin China Holdings Limited (Incorporated in Bermuda with limited liability) (Stock code: 8046) Cancellation of listing,https://www.hkex.com.hk/News/Regulatory-Announcements/2019/190626news?sc_lang=en,08046,cancellation
2019,20 Jun 2019,Announcement - In relation to the matter of Midas Holdings Limited (Incorporated in Singapore with limited liability) (Stock code: 1021) Proceeding to third stage of delisting procedures,https://www.hkex.com.hk/News/Regulatory-Announcements/2019/1906202news?sc_lang=en,01021,other
2019,20 Jun 2019,Announcement - In relation to the matter of Ding He Mining Holdings Limited (Incorporated in Hong Kong with limited liability) (Stock Code: 705) Proceeding to third stage of delisting procedures,https://www.hkex.com.hk/News/Regulatory-Announcements/2019/190620news?sc_lang=en,00705,other
2019,13 Jun 2019,Announcement - In relation to the matter of Asia Coal Limited (Incorporated in Bermuda with limited liability) (Stock Code: 835) Cancellation of listing,https://www.hkex.com.hk/News/Regulatory-Announcements/2019/190613news?sc_lang=en,00835,cancellation
2019,12 Jun 2019,The Listing Committee censures Kiu Hung International Holdings Limited (Stock Code: 381) and a number of its current and former directors for breaching the Listing Rules and/or the Director’s Undertaking,https://www.hkex.com.hk/News/Regulatory-Announcements/2019/190612news?sc_lang=en,00381,other
2019,29 May 2019,HKEX Hosts Biotech Week 2019,https://www.hkex.com.hk/News/Regulatory-Announcements/2019/190529news?sc_lang=en,,other
2019,24 May 2019,Exchange Publishes Conclusions on Proposed Rule Changes Relating to Disclaimer or Adverse Audit Opinion on Issuer’s Financial Statements,https://www.hkex.com.hk/News/Regulatory-Announcements/2019/190524news?sc_lang=en,,other
2019,17 May 2019,Exchange Seeks Views on Strengthening ESG Rules and Publishes Guidance Materials on ESG and Gender Diversity,https://www.hkex.com.hk/News/Regulatory-Announcements/2019/1905172news?sc_lang=en,,other
2019,17 May 2019,The Listing Committee censures Weiqiao Textile Company Limited (Stock Code: 2698) and three of its current directors for breaching the Listing Rules and/or the Director’s Undertaking,https://www.hkex.com.hk/News/Regulatory-Announcements/2019/190517news?sc_lang=en,02698,other
2019,16 May 2019,Announcement - In relation to the matter of China Huishan Dairy Holdings Company Limited (Provisional Liquidators Appointed) (Incorporated in Cayman Islands with limited liability) (Stock code: 6863) Proceeding to third stage of delisting procedures,https://www.hkex.com.hk/News/Regulatory-Announcements/2019/190516news?sc_lang=en,06863,other
2019,14 May 2019,The Listing Committee censures GT Group Holdings Limited (Stock Code: 263) and a number of its current and former directors for breaching the Listing Rules and/or the Director’s Undertaking,https://www.hkex.com.hk/News/Regulatory-Announcements/2019/190514news?sc_lang=en,00263,other
2019,26 Apr 2019,Exchange Updates and Streamlines Guidance Materials,https://www.hkex.com.hk/News/Regulatory-Announcements/2019/190426news?sc_lang=en,,other
2019,25 Mar 2019,Reminder of Deadline for Applications to the Listing Committee and Listing Review Committee,https://www.hkex.com.hk/News/Regulatory-Announcements/2019/190325news?sc_lang=en,,listing_review
2019,22 Mar 2019,Exchange Publishes Guidance on Reasons for Rejected Listing Applications in 2018,https://www.hkex.com.hk/News/Regulatory-Announcements/2019/1903225news?sc_lang=en,,other
2019,22 Mar 2019,Exchange Updates and Streamlines Guidance Materials,https://www.hkex.com.hk/News/Regulatory-Announcements/2019/1903224news?sc_lang=en,,other
2019,22 Mar 2019,Announcement - In relation to the matter of Cloud Investment Holdings Limited (Stock Code: 8129) Cancellation of listing,https://www.hkex.com.hk/News/Regulatory-Announcements/2019/1903223news?sc_lang=en,08129,cancellation
2019,19 Mar 2019,Exchange Publishes its Latest Listing Committee Report,https://www.hkex.com.hk/News/Regulatory-Announcements/2019/190319news?sc_lang=en,,other
2019,06 Mar 2019,Announcement - In relation to the matter of Zhongda International Holdings Limited (Incorporated in Bermuda with limited liability) (Stock Code: 909) Cancellation of listing,https://www.hkex.com.hk/News/Regulatory-Announcements/2019/190306news?sc_lang=en,00909,cancellation
2019,19 Feb 2019,Announcement - In relation to the matter of China Taifeng Beddings Holdings Limited (Provisional Liquidators Appointed) (Stock Code: 873) Cancellation of listing,https://www.hkex.com.hk/News/Regulatory-Announcements/2019/190219news?sc_lang=en,00873,cancellation
2019,18 Feb 2019,Announcement - In relation to the matter of Victory Group Limited (Incorporated in Bermuda with limited liability) (Stock Code: 1139) Proceeding to third stage of delisting procedures,https://www.hkex.com.hk/News/Regulatory-Announcements/2019/190218news?sc_lang=en,01139,other
2019,13 Feb 2019,Announcement - In relation to the matter of China Fiber Optic Network System Group Limited (In Liquidation) (Incorporated in Cayman Islands with limited liability) (Stock Code: 3777) Cancellation of listing,https://www.hkex.com.hk/News/Regulatory-Announcements/2019/190213news?sc_lang=en,03777,cancellation
2019,01 Feb 2019,Exchange Publishes Consultation Conclusions on Proposed Changes to Documentary Requirements and other Minor Rule Amendments,https://www.hkex.com.hk/News/Regulatory-Announcements/2019/190201news?sc_lang=en,,other
2019,31 Jan 2019,Exchange Publishes Results of Latest Review of Issuers’ Annual Report Disclosure,https://www.hkex.com.hk/News/Regulatory-Announcements/2019/1901312news?sc_lang=en,,other
2019,25 Jan 2019,Listing Nominating Committee Seeks Candidates for Inaugural Listing Review Committee,https://www.hkex.com.hk/News/Regulatory-Announcements/2019/190125news?sc_lang=en,,listing_review
2019,25 Jan 2019,Listing Nominating Committee Seeks Listing Committee Candidates,https://www.hkex.com.hk/News/Regulatory-Announcements/2019/1901252news?sc_lang=en,,other
2019,18 Jan 2019,Exchange Publishes Consultation Conclusions on Proposed Changes to Review Structure for Listing Committee Decisions,https://www.hkex.com.hk/News/Regulatory-Announcements/2019/190118news?sc_lang=en,,other
2020,22 Dec 2020,Announcement – In relation to the matter of Combest Holdings Limited (Incorporated in Cayman Islands with limited liability) (Stock Code: 8190) Cancellation of listing,https://www.hkex.com.hk/News/Regulatory-Announcements/2020/201222news?sc_lang=en,08190,cancellation
2020,18 Dec 2020,"Exchange Publishes Conclusions on Paperless Listing & Subscription Regime, Online Display of Documents and Reduction of the Types of Documents on Display",https://www.hkex.com.hk/News/Regulatory-Announcements/2020/201218news?sc_lang=en,,other
2020,11 Dec 2020,"Exchange Publishes its Latest Review of Issuers’ Corporate Governance Practices, and Practitioners’ Insights on Corporate Governance and ESG",https://www.hkex.com.hk/News/Regulatory-Announcements/2020/201211news?sc_lang=en,,other
2020,11 Dec 2020,Announcement – In relation to the matter of Hua Han Health Industry Holdings Limited (In Compulsory Liquidation) (Incorporated in Cayman Islands with limited liability) (Stock Code: 587) Cancellation of listing,https://www.hkex.com.hk/News/Regulatory-Announcements/2020/2012113news?sc_lang=en,00587,cancellation
2020,11 Dec 2020,Announcement – In relation to the matter of Netel Technology (Holdings) Limited (Incorporated in the Cayman Islands with limited liability) (Stock Code: 8256) Cancellation of listing,https://www.hkex.com.hk/News/Regulatory-Announcements/2020/2012112news?sc_lang=en,08256,cancellation
2020,10 Dec 2020,Announcement – In relation to the matter of SMI Holdings Group Limited (In Liquidation) (Incorporated in Bermuda with limited liability) (Stock Code: 198) Cancellation of listing,https://www.hkex.com.hk/News/Regulatory-Announcements/2020/201210news?sc_lang=en,00198,cancellation
2020,04 Dec 2020,Announcement – In relation to the matter of Wuzhou International Holdings Limited (Incorporated in Cayman Islands with limited liability) (Stock Code: 1369) Cancellation of listing,https://www.hkex.com.hk/News/Regulatory-Announcements/2020/201204news?sc_lang=en,01369,cancellation
2020,02 Dec 2020,Announcement – In relation to the matter of Haitian Energy International Limited (In provisional liquidation) (Incorporated in the Cayman Islands with limited liability) (Stock Code: 1659) Cancellation of listing,https://www.hkex.com.hk/News/Regulatory-Announcements/2020/201202news?sc_lang=en,01659,cancellation
2020,27 Nov 2020,Exchange Publishes Consultation Paper on Main Board Profit Requirement,https://www.hkex.com.hk/News/Regulatory-Announcements/2020/201127news?sc_lang=en,,other
2020,26 Nov 2020,Announcement – In relation to the matter of Centron Telecom International Holding Limited (In Provisional Liquidation) (Incorporated in the Cayman Islands with limited liability) (Stock Code: 1155) Cancellation of listing,https://www.hkex.com.hk/News/Regulatory-Announcements/2020/201126news?sc_lang=en,01155,cancellation
2020,25 Nov 2020,Announcement – In relation to the matter of DBA Telecommunication (Asia) Holdings Limited (Stock Code: 3335) Cancellation of listing,https://www.hkex.com.hk/News/Regulatory-Announcements/2020/2011252news?sc_lang=en,03335,cancellation
2020,25 Nov 2020,Announcement – In relation to the matter of Chong Sing Holdings Fintech Group Limited (In Official Liquidation) (Incorporated in Cayman Islands with limited liability) (Stock Code: 8207) Cancellation of listing,https://www.hkex.com.hk/News/Regulatory-Announcements/2020/201125news?sc_lang=en,08207,cancellation
2020,13 Nov 2020,Exchange Expands its Biotech Advisory Panel,https://www.hkex.com.hk/News/Regulatory-Announcements/2020/201113news?sc_lang=en,,other
2020,11 Nov 2020,Announcement – In relation to the matter of Tenwow International Holdings Limited (In Provisional Liquidation) (Incorporated in the Cayman Islands with limited liability) (Stock Code: 1219) Cancellation of listing,https://www.hkex.com.hk/News/Regulatory-Announcements/2020/2011113news?sc_lang=en,01219,cancellation
2020,30 Oct 2020,Exchange Publishes Consultation Conclusions on Corporate WVR,https://www.hkex.com.hk/News/Regulatory-Announcements/2020/201030news?sc_lang=en,,other
2020,30 Oct 2020,Announcement – In relation to the matter of Boshiwa International Holding Limited (Provisional Liquidators Appointed) (Stock Code: 1698) Cancellation of listing,https://www.hkex.com.hk/News/Regulatory-Announcements/2020/2010302news?sc_lang=en,01698,cancellation
2020,27 Oct 2020,Announcement – In relation to the matter of China Yu Tian Holdings Limited (Incorporated in the Cayman Islands with limited liability) (Stock Code: 8230) Cancellation of listing,https://www.hkex.com.hk/News/Regulatory-Announcements/2020/201027news?sc_lang=en,08230,cancellation
2020,19 Oct 2020,Appointment of HKEX Risk Management Committee (Statutory) Member,https://www.hkex.com.hk/News/Regulatory-Announcements/2020/201019news?sc_lang=en,,other
2020,16 Oct 2020,Announcement – In relation to the matter of Brightoil Petroleum (Holdings) Limited (Incorporated in the Bermuda with limited liability) Cancellation of listing,https://www.hkex.com.hk/News/Regulatory-Announcements/2020/201016news?sc_lang=en,,cancellation
2020,08 Oct 2020,Announcement – In relation to the matter of CW Group Holdings Limited (In Provisional Liquidation) (Incorporated in the Cayman Islands with limited liability) (Stock Code: 1322) Cancellation of listing,https://www.hkex.com.hk/News/Regulatory-Announcements/2020/201008news?sc_lang=en,01322,cancellation
2020,09 Sep 2020,Announcement – In relation to the matter of Hong Kong Life Sciences and Technologies Group Limited (incorporated in the Cayman Islands with limited liability) (Stock Code: 8085) Cancellation of listing,https://www.hkex.com.hk/News/Regulatory-Announcements/2020/200909news?sc_lang=en,08085,cancellation
2020,03 Sep 2020,The Listing Committee censures Sanai Health Industry Group Company Limited (Stock Code: 1889) and criticises a number of its former and current directors for breaching the Listing Rules and/or the Director’s Undertaking pdf,https://www.hkex.com.hk/-/media/HKEX-Market/News/News-Release/2020/200903news/e_censure-Sanai-Health_0903.pdf,01889,other
2020,28 Aug 2020,Exchange Publishes Consultation Conclusions on Codification of General Waivers and Principles Relating to IPOs and Listed Issuers and Minor Rule Amendments,https://www.hkex.com.hk/News/Regulatory-Announcements/2020/200828news?sc_lang=en,,other
2020,21 Aug 2020,Exchange Publishes Chapter 37 Consultation Conclusions and Guidance on Disclosures in Listing Documents and Continuing Obligations under Chapter 37,https://www.hkex.com.hk/News/Regulatory-Announcements/2020/200821news?sc_lang=en,,other
2020,11 Aug 2020,The Listing Committee censures Zhongtian International Limited (Stock Code: 2379) and a number of its former and current directors for breaching the Listing Rules and/or the Director’s Undertaking pdf,https://www.hkex.com.hk/-/media/HKEX-Market/News/News-Release/2020/200811news/e_censure-Zhongtian_LD.pdf,02379,other
2020,07 Aug 2020,Exchange Publishes Consultation Paper on Review of Disciplinary Powers and Sanctions,https://www.hkex.com.hk/News/Regulatory-Announcements/2020/200807news?sc_lang=en,,other
2020,30 Jul 2020,Announcement – In relation to the matter of Peace Map Holding Limited (In Liquidation) (Incorporated in the Cayman Islands and continued in Bermuda with limited liability) (Stock Code: 402) Cancellation of listing,https://www.hkex.com.hk/News/Regulatory-Announcements/2020/200730news?sc_lang=en,00402,cancellation
2020,24 Jul 2020,"Exchange invites feedback on Proposals to Introduce a Paperless Listing & Subscription Regime, Online Display of Documents and Reduction of the Types of Documents on Display",https://www.hkex.com.hk/News/Regulatory-Announcements/2020/200724news?sc_lang=en,,other
2020,10 Jul 2020,Appointment of Listing Committee Members,https://www.hkex.com.hk/News/Regulatory-Announcements/2020/200710news?sc_lang=en,,other
2020,10 Jul 2020,Appointment of Listing Review Committee Members,https://www.hkex.com.hk/News/Regulatory-Announcements/2020/2007102news?sc_lang=en,,listing_review
2020,08 Jul 2020,"The Listing Committee censures State Energy Group International Assets Holdings Limited (“Company”) (Stock Code: 918) and Mr Zhou Xin Yu, former executive director and CEO of the Company, for breaching the Listing Rules and/or the Director’s Undertaking pdf",https://www.hkex.com.hk/-/media/HKEX-Market/News/News-Release/2020/200708news/e_censure-State-Energy-Group_LD.pdf,00918,other
2020,03 Jul 2020,Announcement – In relation to the matter of Celebrate International Holdings Limited (the “Company”) (Incorporated in Cayman Islands with limited liability) (Stock Code: 8212) Cancellation of listing,https://www.hkex.com.hk/News/Regulatory-Announcements/2020/200703news?sc_lang=en,08212,cancellation
